<?xml version="1.0" encoding="UTF-8"?>
<mobiles xmlns="http://www.magic.com/mobile" xmlns:xsi="http://www.w3.org/2001/XMLSchema-instance"
	xsi:schemaLocation="http://www.magic.com/mobile mobile.xsd ">
	<mobile>
				<name>iPhone</name>
				<version>X</version>
				<price>9202</price>
				<memory>32GB</memory>
					<memory>16GB</memory>
				<memory>16GB</memory>
				<color>white</color>
				<description>iPhone really very nice mobile phone!</description>
	</mobile>
	
	<mobile>
				<name>Android</name>
				<version>3.2</version>
				<price>92</price>
				<memory>32GB</memory>
					<memory>4GB</memory>
				<memory>8GB</memory>
				<color>black</color>
				<description>Android really very nice mobile phone!</description>
	</mobile>
	
	<mobile>
				<name>iPhone</name>
				<version>X</version>
				<price>9202</price>
				<memory>32GB</memory>
					<memory>16GB</memory>
				<memory>16GB</memory>
				<color>white</color>
				<description>iPhone really very nice mobile phone!</description>
	</mobile>
	
</mobiles>